{
  "reviewDecisionId": "01J9RV2B3C4D5E6F7G8H9K0P1A",
  "envelope": {
    "schemaVersion": "1.0.0",
    "createdAt": "2026-07-30T02:10:00Z",
    "createdBy": {
      "kind": "human",
      "name": "Phase 0 operator (fixture)"
    }
  },
  "jobId": "test-mixed",
  "subjectDraftRenderId": "01J9RD2B3C4D5E6F7G8H9K0N2B",
  "subjectEdlId": "01J9ED2B3C4D5E6F7G8H9K0M6T",
  "subjectRenderManifestId": "01J9RM2B3C4D5E6F7G8H9K0N1A",
  "subjectPlanHash": {
    "algorithm": "sha256",
    "value": "de1420980ea9dff6de1420980ea9dff6de1420980ea9dff6de1420980ea9dff6"
  },
  "decidedBy": "Phase 0 operator (fixture)",
  "decidedAt": "2026-07-30T02:10:00Z",
  "decision": {
    "outcome": "approved",
    "notes": "Hook lands in the first 1.2 s and the payoff is intact. Captions are legible at 720 wide."
  }
}
