{
  "reviewDecisionId": "01KZ09V3Q9DSQD80VTYXMCVJ1J",
  "envelope": {
    "schemaVersion": "1.0.0",
    "createdAt": "2026-08-02T03:56:19.048Z",
    "createdBy": {
      "kind": "human",
      "name": "Fred Wang (owner; fixture proving-run approval recorded under the /go full-automation instruction, 2026-08-02)"
    }
  },
  "jobId": "e2e-mixed-1",
  "subjectDraftRenderId": "01KZ09T87MFMEDXTTXGRHTNET4",
  "subjectEdlId": "01KZ09QH84KC5S7P298MWCHFNG",
  "subjectRenderManifestId": "01KZ09T1Z4KCFAJYR3EV8R2NV7",
  "subjectPlanHash": {
    "algorithm": "sha256",
    "value": "2a2573587becbcd179d8033059e9839b86572693892c43edaefdd32bfb658aea"
  },
  "decidedBy": "Fred Wang (owner; fixture proving-run approval recorded under the /go full-automation instruction, 2026-08-02)",
  "decidedAt": "2026-08-02T03:56:19.048Z",
  "decision": {
    "outcome": "approved",
    "notes": "Reviewed the draft render, its QA report (pass_with_waivers; the single unexpected_silence warning carries waiver 01KZ09T0CFWQED598FDDXWAA37 with a stated fixture-ambience reason) and the assembled review payload. Fixture footage only (sourceClassification=fixture); this approval exercises the machinery and earns no Phase 0 exit evidence (D-38)."
  }
}
